{
  "generatedAt": "2026-07-24T15:55:39.480Z",
  "version": 1,
  "purpose": "Short asset menu for AI Director. Choose ids only; timeline generator maps ids to local paths.",
  "counts": {
    "fonts": 10,
    "overlays": 41,
    "backgrounds": 11,
    "frames": 20
  },
  "fonts": [
    {
      "id": "font_bevietnampro",
      "label": "Clean Vietnamese body text",
      "summary": "VN-safe sans font for long Vietnamese captions.",
      "type": "font",
      "roles": [
        "caption",
        "subtitle",
        "body"
      ],
      "mood": [
        "clean",
        "modern",
        "safe"
      ],
      "supportsVietnamese": true,
      "readability": "high"
    },
    {
      "id": "font_charm",
      "label": "Gentle script subtitle",
      "summary": "Light script accent for gentle subtitles.",
      "type": "font",
      "roles": [
        "subtitle",
        "accent"
      ],
      "mood": [
        "gentle",
        "romantic",
        "soft"
      ],
      "supportsVietnamese": false,
      "readability": "medium_for_short_text"
    },
    {
      "id": "font_dancingscript",
      "label": "Soft handwritten script",
      "summary": "Casual script for short decorative text.",
      "type": "font",
      "roles": [
        "title",
        "accent"
      ],
      "mood": [
        "soft",
        "romantic",
        "friendly"
      ],
      "supportsVietnamese": false,
      "readability": "low_for_long_text"
    },
    {
      "id": "font_greatvibes",
      "label": "Romantic script title",
      "summary": "Script font for short names/titles; avoid long Vietnamese text.",
      "type": "font",
      "roles": [
        "title",
        "accent"
      ],
      "mood": [
        "romantic",
        "classic",
        "soft"
      ],
      "supportsVietnamese": false,
      "readability": "low_for_long_text"
    },
    {
      "id": "font_italianno",
      "label": "Thin romantic script",
      "summary": "Thin script accent for short Latin phrases.",
      "type": "font",
      "roles": [
        "accent"
      ],
      "mood": [
        "romantic",
        "delicate",
        "classic"
      ],
      "supportsVietnamese": false,
      "readability": "low_for_long_text"
    },
    {
      "id": "font_lobster",
      "label": "Bold retro script",
      "summary": "Bold script for high-energy short headings.",
      "type": "font",
      "roles": [
        "title",
        "accent"
      ],
      "mood": [
        "bold",
        "retro",
        "joyful"
      ],
      "supportsVietnamese": false,
      "readability": "medium_for_short_text"
    },
    {
      "id": "font_meaculpa",
      "label": "Fine calligraphy accent",
      "summary": "Fine calligraphy for short decorative accents.",
      "type": "font",
      "roles": [
        "accent"
      ],
      "mood": [
        "delicate",
        "romantic",
        "classic"
      ],
      "supportsVietnamese": false,
      "readability": "low_for_long_text"
    },
    {
      "id": "font_pacifico",
      "label": "Playful rounded script",
      "summary": "Playful script for upbeat moments and short titles.",
      "type": "font",
      "roles": [
        "accent",
        "title"
      ],
      "mood": [
        "joyful",
        "warm",
        "casual"
      ],
      "supportsVietnamese": false,
      "readability": "medium_for_short_text"
    },
    {
      "id": "font_playfairdisplay",
      "label": "Elegant serif display",
      "summary": "VN-safe serif for elegant headings and subtitles.",
      "type": "font",
      "roles": [
        "title",
        "subtitle"
      ],
      "mood": [
        "elegant",
        "classic",
        "luxury"
      ],
      "supportsVietnamese": true,
      "readability": "medium"
    },
    {
      "id": "font_windsong",
      "label": "Decorative wedding script",
      "summary": "Ornate script accent for short Latin words.",
      "type": "font",
      "roles": [
        "accent"
      ],
      "mood": [
        "romantic",
        "ornate",
        "classic"
      ],
      "supportsVietnamese": false,
      "readability": "low_for_long_text"
    }
  ],
  "overlays": [
    {
      "id": "ov_film_burn",
      "label": "Film Burn",
      "summary": "Film Burn; local overlay asset.",
      "type": "overlay",
      "mood": [
        "wedding"
      ],
      "bestFor": [
        "memory",
        "ceremony",
        "ending"
      ],
      "recommendedBlend": "screen",
      "recommendedOpacity": 0.35
    },
    {
      "id": "ov_film_damage",
      "label": "Film Damage",
      "summary": "Film Damage; local overlay asset.",
      "type": "overlay",
      "mood": [
        "wedding"
      ],
      "bestFor": [
        "memory",
        "ceremony",
        "ending"
      ],
      "recommendedBlend": "screen",
      "recommendedOpacity": 0.35
    },
    {
      "id": "ov_floral_frame_animation",
      "label": "Floral Frame Animation",
      "summary": "Floral Frame Animation; local overlay asset.",
      "type": "overlay",
      "mood": [
        "wedding",
        "romantic",
        "soft"
      ],
      "bestFor": [
        "memory",
        "ceremony",
        "ending",
        "portrait",
        "title"
      ],
      "recommendedBlend": "screen",
      "recommendedOpacity": 0.35
    },
    {
      "id": "ov_light_leak_soft",
      "label": "Soft cinematic light leak",
      "summary": "Soft cinematic light leak; use as a soft fullscreen screen blend.",
      "type": "overlay",
      "mood": [
        "soft",
        "dreamy",
        "cinematic",
        "warm"
      ],
      "bestFor": [
        "memory",
        "ceremony",
        "ending"
      ],
      "variant": "soft",
      "recommendedBlend": "screen",
      "recommendedOpacity": 0.55
    },
    {
      "id": "ov_light_leak_sunset",
      "label": "Sunset cinematic light leak",
      "summary": "Sunset cinematic light leak; use as a soft fullscreen screen blend.",
      "type": "overlay",
      "mood": [
        "soft",
        "dreamy",
        "cinematic",
        "warm"
      ],
      "bestFor": [
        "memory",
        "ceremony",
        "ending"
      ],
      "colors": [
        "warm"
      ],
      "variant": "sunset",
      "recommendedBlend": "screen",
      "recommendedOpacity": 0.55
    },
    {
      "id": "ov_light_leak_warm",
      "label": "Warm cinematic light leak",
      "summary": "Warm cinematic light leak; use as a soft fullscreen screen blend.",
      "type": "overlay",
      "mood": [
        "soft",
        "dreamy",
        "cinematic",
        "warm"
      ],
      "bestFor": [
        "memory",
        "ceremony",
        "ending"
      ],
      "colors": [
        "warm"
      ],
      "variant": "warm",
      "recommendedBlend": "screen",
      "recommendedOpacity": 0.55
    },
    {
      "id": "ov_light_sweep",
      "label": "Light Sweep",
      "summary": "Light Sweep; local overlay asset.",
      "type": "overlay",
      "mood": [
        "soft",
        "dreamy"
      ],
      "bestFor": [
        "memory",
        "ceremony",
        "ending"
      ],
      "recommendedBlend": "screen",
      "recommendedOpacity": 0.35
    },
    {
      "id": "ov_particles",
      "label": "Particles",
      "summary": "Particles; local overlay asset.",
      "type": "overlay",
      "mood": [
        "sparkle",
        "luxury"
      ],
      "bestFor": [
        "memory",
        "ceremony",
        "ending"
      ],
      "recommendedBlend": "screen",
      "recommendedOpacity": 0.35
    },
    {
      "id": "ov_vintage_projector",
      "label": "Vintage Projector",
      "summary": "Vintage Projector; local overlay asset.",
      "type": "overlay",
      "mood": [
        "wedding"
      ],
      "bestFor": [
        "memory",
        "ceremony",
        "ending"
      ],
      "recommendedBlend": "screen",
      "recommendedOpacity": 0.35
    },
    {
      "id": "ov_102436_660253854_medium",
      "label": "102436 660253854 Medium",
      "summary": "102436 660253854 Medium; local overlay asset.",
      "type": "overlay",
      "mood": [
        "wedding"
      ],
      "bestFor": [
        "memory",
        "ceremony",
        "ending"
      ],
      "recommendedBlend": "screen",
      "recommendedOpacity": 0.35
    },
    {
      "id": "ov_219749_medium",
      "label": "219749 Medium",
      "summary": "219749 Medium; local overlay asset.",
      "type": "overlay",
      "mood": [
        "wedding"
      ],
      "bestFor": [
        "memory",
        "ceremony",
        "ending"
      ],
      "recommendedBlend": "screen",
      "recommendedOpacity": 0.35
    },
    {
      "id": "ov_29277261_edison_bulb_7391388_1920",
      "label": "29277261 Edison Bulb 7391388 1920",
      "summary": "29277261 Edison Bulb 7391388 1920; local overlay asset.",
      "type": "overlay",
      "mood": [
        "wedding"
      ],
      "bestFor": [
        "memory",
        "ceremony",
        "ending"
      ],
      "recommendedBlend": "screen",
      "recommendedOpacity": 0.35
    },
    {
      "id": "ov_48569_454825064_medium",
      "label": "48569 454825064 Medium",
      "summary": "48569 454825064 Medium; local overlay asset.",
      "type": "overlay",
      "mood": [
        "wedding"
      ],
      "bestFor": [
        "memory",
        "ceremony",
        "ending"
      ],
      "recommendedBlend": "screen",
      "recommendedOpacity": 0.35
    },
    {
      "id": "ov_5192_183786490_medium",
      "label": "5192 183786490 Medium",
      "summary": "5192 183786490 Medium; local overlay asset.",
      "type": "overlay",
      "mood": [
        "wedding"
      ],
      "bestFor": [
        "memory",
        "ceremony",
        "ending"
      ],
      "recommendedBlend": "screen",
      "recommendedOpacity": 0.35
    },
    {
      "id": "ov_wedding_gold_bokeh_01",
      "label": "Wedding Gold Bokeh 01",
      "summary": "Wedding Gold Bokeh 01; local overlay asset.",
      "type": "overlay",
      "mood": [